{
  "schema_version": 8,
  "$schema": "https://raw.githubusercontent.com/lixiuyin/web-agent/main/src/webagent/schemas/run-trace-v8.schema.json",
  "producer": {
    "name": "lixiuyin-webagent",
    "version": "0.2.0",
    "source_sha256": "29b5cb81ec7159bf22a38e81e1d86d8e389674f1c0d9779354e4750165c9009c"
  },
  "created_at": "2026-09-01T13:12:25.508368+00:00",
  "run_id": "6a273460-a503-49f8-8201-3fe7780b56a5",
  "run_kind": "agent_e2e",
  "task": "Summarize what the Playwright Page class represents and cite the exact URL.",
  "status": "completed",
  "success": true,
  "steps_taken": 5,
  "total_duration": 96.52147626876831,
  "final_result": {
    "summary": "**What the Playwright `Page` class represents**\n\nPer the official Playwright for Python API reference page (title: \"Page | Playwright Python\"):\n\n- **Core definition:** \"Page provides methods to interact with a single tab in a `Browser`, or an extension background page in Chromium. One `Browser` instance might have multiple `Page` instances.\" In other words, `Page` is the API object that models **one browser tab (one document/frame tree)** — or, in Chromium, a single extension background page — and it is the main workhorse class through which a test/script drives that tab.\n- **Lifecycle/creation:** Pages are not constructed directly by users; they are obtained from a `Browser` (e.g. `browser.new_page()` / `browser.new_browser_cdp_session()`-style workflows) or from a `BrowserContext`, and the same `Browser` can host many concurrent `Page` objects. The documented example on the page creates a page, navigates it to a URL, and then saves a screenshot (shown in both Sync and Async API tabs, e.g. `from playwright.sync_api import sync_playwright, Playwright` → `browser = webkit.launch()` → page → `page.goto(...)` → `page.screenshot(...)`).\n- **Responsibilities exposed by the class:** navigation (`goto`, reload/back/forward), input/interaction with elements (click/type/hover, plus locator handling such as `add_locator_handler` listed in the page's table of contents), waiting for conditions/navigation, reading page state (content, titles, URLs, screenshots/PDFs), network-related behavior (requests/responses, routing, mocking), dialogs/downloads, JavaScript execution, and keyboard/mouse/touchscreen helpers.\n- **Event model:** \"The `Page` class emits various events (described below) which can be handled using any of Node's native `EventEmitter` methods, such as `on`, `once` or `removeListener`.\" In the Python binding this corresponds to subscribing with `page.on(...)` / `page.once(...)` for events such as console messages, page errors, requests/responses, dialogs, downloads, and popup/close.\n- **Related class names cross-linked in the intro:** the page links to \"extension background page\" and to `Page`/`Browser`/`APIRequest` class references, situating `Page` inside the layered object model `Playwright → BrowserType → Browser → BrowserContext → Page → Frame/Locator`.\n\n**Exact cited URL:** https://playwright.dev/python/docs/api/class-page (confirmed via the browser's current-URL check, which returned exactly this address; page title observed as \"Page | Playwright Python\").",
    "attachments": [],
    "success_probability": 0.96
  },
  "evaluation": {
    "agent_source_sha256": "29b5cb81ec7159bf22a38e81e1d86d8e389674f1c0d9779354e4750165c9009c",
    "mode": "browser_grounded",
    "discovery_mode": "browser-grounded",
    "direct_source_tools_enabled": false,
    "high_risk_action_policy": "deny",
    "stealth_mode": false,
    "anti_shortcut_contract": null,
    "certificate_required": false,
    "strict_eval_mode": false,
    "search_engine_only": false,
    "browser_profile_mode": "temporary",
    "browser_channel": "bundled",
    "persistent_pdf_cache": false
  },
  "planner_attempts": [
    {
      "step_number": 1,
      "attempt_number": 1,
      "timestamp": "2026-09-01T13:10:58.484616+00:00",
      "duration_seconds": 3.4271018505096436,
      "success": true,
      "error": null,
      "transport_retries": 0,
      "response_length": 0,
      "finish_reason": "tool_calls",
      "prompt_tokens": 6890,
      "completion_tokens": 143,
      "total_tokens": 7033,
      "requested_output_mode": "auto",
      "effective_output_mode": "native-tools",
      "structured_fallbacks": []
    },
    {
      "step_number": 2,
      "attempt_number": 1,
      "timestamp": "2026-09-01T13:11:14.130648+00:00",
      "duration_seconds": 3.9544169902801514,
      "success": true,
      "error": null,
      "transport_retries": 0,
      "response_length": 0,
      "finish_reason": "tool_calls",
      "prompt_tokens": 6973,
      "completion_tokens": 182,
      "total_tokens": 7155,
      "requested_output_mode": "auto",
      "effective_output_mode": "native-tools",
      "structured_fallbacks": []
    },
    {
      "step_number": 3,
      "attempt_number": 1,
      "timestamp": "2026-09-01T13:11:31.265402+00:00",
      "duration_seconds": 5.682955026626587,
      "success": true,
      "error": null,
      "transport_retries": 0,
      "response_length": 0,
      "finish_reason": "tool_calls",
      "prompt_tokens": 7277,
      "completion_tokens": 108,
      "total_tokens": 7385,
      "requested_output_mode": "auto",
      "effective_output_mode": "native-tools",
      "structured_fallbacks": []
    },
    {
      "step_number": 4,
      "attempt_number": 1,
      "timestamp": "2026-09-01T13:12:02.706646+00:00",
      "duration_seconds": 19.6177659034729,
      "success": true,
      "error": null,
      "transport_retries": 0,
      "response_length": 0,
      "finish_reason": "tool_calls",
      "prompt_tokens": 7346,
      "completion_tokens": 149,
      "total_tokens": 7495,
      "requested_output_mode": "auto",
      "effective_output_mode": "native-tools",
      "structured_fallbacks": []
    },
    {
      "step_number": 5,
      "attempt_number": 1,
      "timestamp": "2026-09-01T13:12:25.484157+00:00",
      "duration_seconds": 10.865843057632446,
      "success": true,
      "error": null,
      "transport_retries": 0,
      "response_length": 0,
      "finish_reason": "tool_calls",
      "prompt_tokens": 7665,
      "completion_tokens": 933,
      "total_tokens": 8598,
      "requested_output_mode": "auto",
      "effective_output_mode": "native-tools",
      "structured_fallbacks": []
    }
  ],
  "events": [
    {
      "type": "strategy_switch",
      "timestamp": "2026-09-01T13:11:04.471710+00:00",
      "step_number": 1,
      "previous": "default",
      "current": "search-discovery",
      "reason": "execution policy denied goto"
    },
    {
      "type": "replan",
      "timestamp": "2026-09-01T13:11:04.471721+00:00",
      "step_number": 1,
      "reason": "execution policy denied goto",
      "strategy": "search-discovery",
      "exhausted": false
    },
    {
      "type": "strategy_switch",
      "timestamp": "2026-09-01T13:12:14.618290+00:00",
      "step_number": 5,
      "previous": "search-discovery",
      "current": "alternate-navigation",
      "reason": "loop detector reported page_stagnation"
    },
    {
      "type": "replan",
      "timestamp": "2026-09-01T13:12:14.618306+00:00",
      "step_number": 5,
      "reason": "loop detector reported page_stagnation",
      "strategy": "alternate-navigation",
      "exhausted": false
    }
  ],
  "steps": [
    {
      "step_number": 1,
      "run_id": "6a273460-a503-49f8-8201-3fe7780b56a5",
      "timestamp": "2026-09-01T13:11:04.471657+00:00",
      "tool": "goto",
      "parameters": {
        "url": "https://playwright.dev/python/docs/api/class-page",
        "wait_until": "domcontentloaded"
      },
      "reasoning": "",
      "success": false,
      "error": "Policy denied tool call: already on this exact URL; interact with the current page instead, or use reload only when an explicit refresh is required",
      "result": {},
      "planner_visible_result": "{}",
      "policy": {
        "policy": "browser_grounded",
        "decision": "deny",
        "reason": "already on this exact URL; interact with the current page instead, or use reload only when an explicit refresh is required",
        "policy_step": 1,
        "target": "https://playwright.dev/python/docs/api/class-page",
        "provenance": {}
      },
      "duration_seconds": 15.490630149841309,
      "tool_duration_seconds": 0.000141143798828125
    },
    {
      "step_number": 2,
      "run_id": "6a273460-a503-49f8-8201-3fe7780b56a5",
      "timestamp": "2026-09-01T13:11:20.124787+00:00",
      "tool": "frame_interact",
      "parameters": {
        "action": "extract_text",
        "frame_index": 0,
        "selector": {
          "type": "css",
          "value": "article div.markdown p"
        }
      },
      "reasoning": "",
      "success": true,
      "error": null,
      "result": {
        "frame_index": 0,
        "action": "extract_text",